date,username,to,replies,retweets,favorites,text,geo,mentions,hashtags,id,permalink
2019-11-30 23:51:30,CyberGopher,,0,3,5,"#YangGang #Yang2020 @AndrewYang will be in Burlington IOWA for Beers with Yang @ChicagoYangGang #Yang @DSMYangGang #Yang2020 @GangUbi @YangVets @TruckersForYang @HadahiiliYazhi @mykmc13 @VisurantViz @vets4yang @veteransforyang @mykmc13 @Lor12Lee Event Link https://www.mobilize.us/yang2020/event/166049/?rname=Dave&amp;share_context=event-detail-page-modal&amp;share_medium=copy_link",,@AndrewYang @ChicagoYangGang @DSMYangGang @GangUbi @YangVets @TruckersForYang @HadahiiliYazhi @mykmc13 @VisurantViz @vets4yang @veteransforyang @mykmc13 @Lor12Lee,#YangGang #Yang2020 #Yang #Yang2020,1200925351192485888,https://twitter.com/CyberGopher/status/1200925351192485888
2019-11-30 23:47:32,imaginelove,Nebraskans4Yang,1,0,13,"Ground must be more fertile in Nebraska than Kansas.... My daughter in law did order a sign which brings the total I know of in this city of around 400,000 people to 3. When I was contacted by a textbanker for #Yang they were looking for 14 donors from the Entire State. ",,,#Yang,1200924352067375105,https://twitter.com/imaginelove/status/1200924352067375105
2019-11-30 23:38:56,DonCarlosToledo,TheyLockedMe,1,0,0,"Sure, and b/c political media in this country thinks the known Universe begins in Midtown Manhattan and ends at the Jefferson Memorial, they're completely incapable of understanding where the country is at on a whole host of issues. Explains why they don't understand #Yang too",,,#Yang,1200922187906990081,https://twitter.com/DonCarlosToledo/status/1200922187906990081
2019-11-30 23:25:30,PAforYang2,VoiceofCal,0,0,0,"#YangGang2020 #yang ",,,#YangGang2020 #yang,1200918806845120512,https://twitter.com/PAforYang2/status/1200918806845120512
2019-11-30 23:10:36,CyberGopher,,0,1,3,"@AndrewYang is IN THE HOUSE and HE HAS BEER on DEC10 in Burlington IOWA Doors open 8PM, 8:30-930PM CST in at the BEERS WITH YANG EVENT at The Washington, 306 Washington St Burlington, IA 52601 so grab a beer with #Yang @VisurantViz @YangVets @vets4yang #Yang2020 #YangGang",,@AndrewYang @VisurantViz @YangVets @vets4yang,#Yang #Yang2020 #YangGang,1200915059263909888,https://twitter.com/CyberGopher/status/1200915059263909888
2019-11-30 23:09:34,LoveIslandLuver,ArmoryYang,0,5,6,"Free #Yang button for $5 donation to http://yang2020.com See tweet below #YangGang! #YangMoneyBomb #YangMoneyBombDay #30Mil4Yang #AndrewYang #Yang2020",,,#Yang #YangGang #YangMoneyBomb #YangMoneyBombDay #30Mil4Yang #AndrewYang #Yang2020,1200914798113767424,https://twitter.com/LoveIslandLuver/status/1200914798113767424
2019-11-30 22:48:46,CyberGopher,,0,3,8,"@AndrewYang is IN THE HOUSE and he has BEER DEC10 Doors open 8PM, 8:30-930PM CST in Burlington IOWA at BEERS WITH YANG EVENT at The Washington, 306 Washington St Burlington, IA 52601 so grab a beer with #Yang @VisurantViz @YangVets @vets4yang #Yang2020 https://www.mobilize.us/yang2020/event/166049/?rname=Dave&amp;share_context=event-detail-page-modal&amp;share_medium=copy_link",,@AndrewYang @VisurantViz @YangVets @vets4yang,#Yang #Yang2020,1200909565568733184,https://twitter.com/CyberGopher/status/1200909565568733184
2019-11-30 22:39:18,48States4Yang,,0,0,4,"Two things I came to Iowa for - #Yang and #corn",,,#Yang #corn,1200907179412189184,https://twitter.com/48States4Yang/status/1200907179412189184
2019-11-30 22:37:37,BuiceTweets,,0,1,5,"Wish I could #Yang every last one of these @realDonaldTrump supporters. If they would take the time to read @AndrewYang policies, they would vote for Yang over Trump. http://yang2020.com/policies #YangBeatsTrump https://youtu.be/uv-EbZMohF0",,@realDonaldTrump @AndrewYang,#Yang #YangBeatsTrump,1200906759210229760,https://twitter.com/BuiceTweets/status/1200906759210229760
2019-11-30 22:36:15,MrJonBurk,nytimes,1,0,2,"It's over for #Harris, #Klobuchar, #Booker, #Steyer, #Yang, #Castro, #Gabbard, and #Bennet. Yang will make a good VP pick for #Bernie. Klobuchar for #Biden. Booker for #Warren. Bloomberg is a non starter (see Howard Schultz). #Election2020 #VoteBlue2020",,,#Harris #Klobuchar #Booker #Steyer #Yang #Castro #Gabbard #Bennet #Bernie #Biden #Warren #Election2020 #VoteBlue2020,1200906413515493376,https://twitter.com/MrJonBurk/status/1200906413515493376
2019-11-30 22:09:51,mxderndvyhippie,,0,0,0,"#Equality demands #Accountability...Like #Yin &amp; #Yang, #Balance will never be if both aren’t #Present.",,,#Equality #Accountability #Yin #Yang #Balance #Present,1200899769331310592,https://twitter.com/mxderndvyhippie/status/1200899769331310592
2019-11-30 22:09:45,jarathkaru,PDXorax,1,0,3,"Thanks a lot brother. Aloha I may not agree with many views points of #Yang. But I respect #Yang I will call out every smear against #Yang !",,,#Yang #Yang #Yang,1200899743519346688,https://twitter.com/jarathkaru/status/1200899743519346688
2019-11-30 21:56:49,Michael10769043,TriciaG_Citizen,0,0,1,"It's the nature of a ""token"" to be fooled into thinking they've broken through. Now she will go along to solidify her position. If the DNC gives you what you want you'll stop donating, so don't expect much from AOC Did we learn nothing from Obama? #Yang means to break their grip.",,,#Yang,1200896491289817088,https://twitter.com/Michael10769043/status/1200896491289817088
2019-11-30 21:51:53,humanity2dot0,,0,0,0,"Mark Zuckerberg backing Pete Buttigieg #yanggang #facebook #yang #tulsi",,,#yanggang #facebook #yang #tulsi,1200895250740301824,https://twitter.com/humanity2dot0/status/1200895250740301824
2019-11-30 21:48:13,Joseph_Rhea,,0,0,0,"Today, remember to embrace all of your opposites, your #Yin and your #Yang, your #Crowley and your #Aziraphale, your #Yoda and your #Doofenshmirtz. Wait, what? #ThingsOnMyWritingDesk",,,#Yin #Yang #Crowley #Aziraphale #Yoda #Yoda #Doofenshmirtz #ThingsOnMyWritingDesk,1200894326928289800,https://twitter.com/Joseph_Rhea/status/1200894326928289800
2019-11-30 21:41:36,WitStream1,brookeleawood,0,0,1,"I spend a lot of time trying to educate them on #Yang because a lot of them support Trump by default for lack of a better option.",,,#Yang,1200892660623400961,https://twitter.com/WitStream1/status/1200892660623400961
2019-11-30 21:39:51,GlitchBro1987,,15,101,311,"#YangGang AUCTION. First to send me a $2700 max out for #Yang receipt gets one of the original art pieces below. These are hand painted acrylic on panel. Receipt must be dated 11/30/2019 and time stamp after 5:00pm and before 12:00am. If no max out occurs goes to highest bidder. ",,,#YangGang #Yang,1200892221496659969,https://twitter.com/GlitchBro1987/status/1200892221496659969
2019-11-30 21:35:59,marktilfordbass,TriciaG_Citizen,4,0,1,"UBI is a good idea. #Yang's UBI, isn't.",,,#Yang,1200891247239581698,https://twitter.com/marktilfordbass/status/1200891247239581698
2019-11-30 21:25:22,YangGangOrlando,,3,29,167,"When I say Andrew you say #Yang! Andrew! Yang! Getting pumped before we walk to the overpass! #YangGang #HumanityFirst #Yang2020",,,#Yang #YangGang #HumanityFirst #Yang2020,1200888575497297921,https://twitter.com/YangGangOrlando/status/1200888575497297921
2019-11-30 21:21:05,Shadarach,KamalaHarris,0,1,2,"You're a great articulator Kammy. I mean at least until you have to debate #Yang or Tulsi who are intellectual heavyweights compared to you.",,,#Yang,1200887496466264064,https://twitter.com/Shadarach/status/1200887496466264064
2019-11-30 21:03:40,BennettElder,,0,0,0,"Remind people that @AndrewYang will ride in your car with you for 7 hours to explain what's happening to America and what we should be doing about it. #HumanityFirst #Yang #YangGang2020 https://www.amazon.com/The-War-on-Normal-People/dp/B07BSHJ8RB/",,@AndrewYang,#HumanityFirst #Yang #YangGang2020,1200883114219900931,https://twitter.com/BennettElder/status/1200883114219900931
2019-11-30 20:57:45,WitStream1,cenkuygur,0,0,1,"On the flip side, #Yang almost literally can't buy coverage. The fix appears to be in, for sure.",,,#Yang,1200881624587501568,https://twitter.com/WitStream1/status/1200881624587501568
2019-11-30 20:56:17,_MarcusLA,,0,0,0,"#Yang &gt; Everyone else #2020 #Democrats #AndrewYang2020 #Election2020",,,#Yang #Democrats #AndrewYang2020 #Election2020,1200881257422344192,https://twitter.com/_MarcusLA/status/1200881257422344192
2019-11-30 20:39:09,Ray_Naissance,musgrove74,0,0,2,"Costco isn’t a bad employer as far as I’ve heard and yet, even a Costco employee understands our UBI is the business. Awesome. Keep calm and #yang on. ",,,#yang,1200876943282827264,https://twitter.com/Ray_Naissance/status/1200876943282827264
2019-11-30 20:36:28,CharityDemay,WisdomOfDan,1,20,35,"Let’s get this guy a #yang of followers and an easy $180 for the campaign thanks dan! ",,,#yang,1200876267802963969,https://twitter.com/CharityDemay/status/1200876267802963969
2019-11-30 20:21:24,Crazyqueso1,,0,1,4,"https://youtu.be/0mMOTg3cUuo @RepAOC please reconsider your stumping for #BernieSanders on the false narrative of #FreedomDividend and #Yang gutting welfare. It's so much better than the patchwork and a VAT is so effective and useful. Please do your research and correct your view.",,@RepAOC,#BernieSanders #FreedomDividend #Yang,1200872477674627072,https://twitter.com/Crazyqueso1/status/1200872477674627072
2019-11-30 20:16:42,ScottKarasick,OkBuddyYangGang,1,0,0,"Yang is not a woman. I actually support women in politics. #Yang is not a woman in politics",,,#Yang,1200871293484011521,https://twitter.com/ScottKarasick/status/1200871293484011521
2019-11-30 20:15:15,ScottKarasick,,0,0,1,"New #Yanggang argument: If you hate #Yang, you MUST HATE WOMEN!!!11!1!1",,,#Yanggang #Yang,1200870930836099072,https://twitter.com/ScottKarasick/status/1200870930836099072
2019-11-30 20:13:27,CyberGopher,,1,20,52,"#YANGGANG @AndrewYang is in the HOUSE at the Chicago Rally Dec5 University of Illinois at Chicago, 725 W. Roosevelt Road at 5 @ChicagoYangGang #Yang #Yang2020 @GangUbi @YangVets @TruckersForYang @HadahiiliYazhi @mykmc13 @VisurantViz @vets4yang @veteransforyang @mykmc13 @Lor12Lee",,@AndrewYang @ChicagoYangGang @GangUbi @YangVets @TruckersForYang @HadahiiliYazhi @mykmc13 @VisurantViz @vets4yang @veteransforyang @mykmc13 @Lor12Lee,#YANGGANG #Yang #Yang2020,1200870477591433216,https://twitter.com/CyberGopher/status/1200870477591433216
2019-11-30 20:01:11,ScottKarasick,,0,0,0,"Weird how both Trump supporters and #Yang supporters demand that we don’t trust the mainstream media",,,#Yang,1200867388687712256,https://twitter.com/ScottKarasick/status/1200867388687712256
2019-11-30 19:57:42,CyberGopher,,0,3,7,"Come on down Join Maryland for #Yang #Yanging Event Dec1st over the 83 on the Wyman Park Dr bridge 11:30-2PM Near 2715-2701 Wyman Park Dr, Baltimore, MD 21211 #YangGang will fly the Yang2020 Banner over the 83 #Yang2020 @AndrewYang @VisurantViz @YangTasks #Yang @HumanityForYang",,@AndrewYang @VisurantViz @YangTasks @HumanityForYang,#Yang #Yanging #YangGang #Yang2020 #Yang,1200866514297069569,https://twitter.com/CyberGopher/status/1200866514297069569
2019-11-30 19:52:50,Max78903,AdoptedBabyYoda,0,0,6,"No matter who u are voteing for, we can all get behind #BabyYoda and the #Mandalorian show. Am I right? Lol #YangGang #Tulsi #BernieBros #Yang #Bernie #BlueWave #Resister #Resistance",,,#BabyYoda #Mandalorian #Mandalorian #YangGang #Tulsi #BernieBros #Yang #Bernie #BlueWave #Resister #Resistance,1200865288230768642,https://twitter.com/Max78903/status/1200865288230768642
2019-11-30 19:49:44,SaraEnki,ihurley007,1,0,1,"lol! No I wouldn't be a good president. I don't have the patience to sit there like #Yang does lol!! I saw you're a teacher. Thanks so much for what you do. I think it's a pillar of our society and it truly builds our future",,,#Yang,1200864509251981312,https://twitter.com/SaraEnki/status/1200864509251981312
2019-11-30 19:08:30,CyberGopher,,0,3,5,"Andrew Yang will be IN THE HOUSE for a Town Hall Mon Dec 3 from 12:30-2 at Colby-Sawyer ~ Wheeler Hall 541 Main St New London, NH 03257 #YangGang #YangGangLove #Yang2020 @AndrewYang @VisurantViz #Yang For Tix https://www.mobilize.us/nhforyang/event/161336/?force_banner=true&amp;share_context=event-detail-page-modal&amp;share_medium=copy_link",,@AndrewYang @VisurantViz,#YangGang #YangGangLove #Yang2020 #Yang,1200854131713413121,https://twitter.com/CyberGopher/status/1200854131713413121
2019-11-30 19:00:08,TribunNew5,,0,0,0,"#Zodiak #yang Diprediksi #Akan Menemukan Cintanya di #Tahun 2020, Mereka Siap untuk Berkomitmen https://lifestyle.tribunnews.biz/",,,#Zodiak #yang #Akan #Tahun,1200852024851619840,https://twitter.com/TribunNew5/status/1200852024851619840
2019-11-30 18:59:46,FTthemusician,,0,1,1,"Those of us who root for #Tulsi, #Bernie, and #Yang must all put aside their differences (because I’ve seen some nasty fights between these groups) and push our candidates to the top. It’s the Establishment v. Freedom and the only way we can prevail is if we work together",,,#Tulsi #Bernie #Yang,1200851934934003712,https://twitter.com/FTthemusician/status/1200851934934003712
2019-11-30 18:48:20,BogusPogus15,,0,0,0,"...antithetical to the status quo (which has worked so well for the MSN). We shouldn’t be surprised that they are fighting them. Instead we should work twice as hard to elevate them 2/2 #Bernie #Warren #Tulsi #Yang.",,,#Bernie #Warren #Tulsi #Yang,1200849055078846464,https://twitter.com/BogusPogus15/status/1200849055078846464
2019-11-30 18:46:35,BogusPogus15,,0,0,0,"It’s no secret that the MSM have not been fairly covering Bernie, Yang and Tulsi, either by not mentioning them at all or by synonymizing them with Russia. These are the candidates that are ready to give a new perspective... 1/2 #Bernie #Warren #Tulsi #Yang",,,#Bernie #Warren #Tulsi #Yang,1200848616245645312,https://twitter.com/BogusPogus15/status/1200848616245645312
2019-11-30 18:43:09,SaraEnki,GigiGloriby,1,0,1,"You are standing up for what is right and the best path forward for humanity. You're doing your best and it's really appreciated. #Yang benefits all of humanity, no agenda.",,,#Yang,1200847753213075459,https://twitter.com/SaraEnki/status/1200847753213075459
2019-11-30 18:30:22,I3ladeDragon,UPP_Polls,2,4,10,"Slay the poll #YangGang #YangGang2020 #Yang #Yang2020 #Yangmentum #AndrewYang #AndrewYang2020 #MATH #SecureTheBag #HumanityFirst #FreedomDividend #YangSurfing #BagSignal #1KaMonthWould #YangTheGOAT #WhatsInTheBox #WTFinTB #YangGangLove #YangGangFamily #YangGangRising #YangThePoll",,,#YangGang #YangGang2020 #Yang #Yang2020 #Yangmentum #AndrewYang #AndrewYang2020 #MATH #SecureTheBag #HumanityFirst #FreedomDividend #YangSurfing #BagSignal #1KaMonthWould #YangTheGOAT #WhatsInTheBox #WTFinTB #YangGangLove #YangGangFamily #YangGangRising #YangThePoll,1200844533929410560,https://twitter.com/I3ladeDragon/status/1200844533929410560
2019-11-30 18:21:54,hjub,bingninginging,1,1,8,"#Yang feels strongly that a large number of student loans should be forgiven.",,,#Yang,1200842403948777472,https://twitter.com/hjub/status/1200842403948777472
2019-11-30 18:12:38,Pabloarturo81,,0,2,0,"#Yang es uno de los aspirantes a ser el candidato presidencial demócrata en #EEUU. Es también un millonario emprendedor, esa es su principal plataforma. Yang ofrece pagar $1,000 al mes a todo ciudadano, el dinero provendría del establecimiento de IVA. ",,,#Yang #EEUU,1200840072117063681,https://twitter.com/Pabloarturo81/status/1200840072117063681
2019-11-30 18:10:41,Anime4l38203318,,0,0,1,"Why did I record this for my twin sister #Yang Xiao Long ",,,#Yang,1200839583979712516,https://twitter.com/Anime4l38203318/status/1200839583979712516
2019-11-30 18:10:32,Riptide360,gariamray,0,1,7,"Promise to NOT buy on your first visit. Use AAA or Costco’s car buying program once you know what you want. Seek out female sales folks and #Yang them!",,,#Yang,1200839544205004800,https://twitter.com/Riptide360/status/1200839544205004800
2019-11-30 18:08:23,Prof_Bruckner,rbg1827,0,0,0,"I think I'm going to mute #Yang. ",,,#Yang,1200839002770812930,https://twitter.com/Prof_Bruckner/status/1200839002770812930
2019-11-30 17:51:16,spaekman,,2,2,6,"'Significance' & 'Abstract' details of the cited 2018 PNAS article titled, ""Contribution of NIH funding to new drug approvals 2010–2016,"" by Cleary and co-workers are attached. Another link to the publication via NCBI. https://www.ncbi.nlm.nih.gov/pmc/articles/PMC5878010/ #MATH #HumanityFirst #YangGang #Yang ",,,#MATH #HumanityFirst #YangGang #Yang,1200834696122380288,https://twitter.com/spaekman/status/1200834696122380288
2019-11-30 17:33:07,sendmethePDF,sendmethePDF,0,1,3,"U: pPL pOwer! bLue aLL tHe wAy! LeT’s mAke thOse cOrpOratiOns pAy. w0meN emPowerMent! pRo-iMmigRantS! #Yang: democracy$, freedom dividend, tech check, wife evelyn center of his campaign, wants 2give every1 (incld. women) power to start businesses, POC U: trojan horse,misogynist",,,#Yang,1200830127891869696,https://twitter.com/sendmethePDF/status/1200830127891869696
2019-11-30 17:31:38,spaekman,McCormickJohn,1,16,45,"#Yang: ""They [Pharma] say they need high prices to fund research. The truth. Most FDA approved drugs rely on research funded by the government that means you paid for it. The old politics won't tell you that I [@AndrewYang] just did."" #MATH #YangGang Ref.: https://doi.org/10.1073/pnas.1715368115",,@AndrewYang,#Yang #MATH #YangGang,1200829752917004288,https://twitter.com/spaekman/status/1200829752917004288
2019-11-30 17:10:19,BuiceTweets,,0,11,25,"The #YangGang is so incredibly generous! I am 1/3 of the way to my goal. I feel honored and inspired to #Yang every person I encounter in Iowa. We are one month away from #YangWeek! Excited to canvass for @AndrewYang. #ForwardTogether #HumanityFirst #MATH",,@AndrewYang,#YangGang #Yang #YangWeek #ForwardTogether #HumanityFirst #MATH,1200824389069103104,https://twitter.com/BuiceTweets/status/1200824389069103104
2019-11-30 17:00:20,WitStream1,MaryLMarx,0,0,0,"I'm surprised you wouldn't consider #Yang should Bernie not work out. Why not?",,,#Yang,1200821878832521217,https://twitter.com/WitStream1/status/1200821878832521217
2019-11-30 16:51:07,HybridPuppet,guardian,0,0,0,"I hope #Yang wins @AndrewYang",,@AndrewYang,#Yang,1200819557105045506,https://twitter.com/HybridPuppet/status/1200819557105045506
2019-11-30 16:47:58,Shadarach,JimOfficious,0,0,0,"Dems know none of their 2020 candidates have the fortitude to run the country so plan B is a smear campaign. I will say #Yang and Tulsi are worth listening to and show superior intellect and emotional intelligence compared to the rest of them.",,,#Yang,1200818766373744641,https://twitter.com/Shadarach/status/1200818766373744641
2019-11-30 16:45:27,jkfellow23,LaceyDelayne,1,0,1,"I wish #Yang was independent!! #Democrats do not deserve his brain. #SaturdayThoughts",,,#Yang #Democrats #SaturdayThoughts,1200818132522283009,https://twitter.com/jkfellow23/status/1200818132522283009
2019-11-30 16:15:54,o_oMalcolm,,0,1,4,"#Yang has huge #republican support because Yang's #FreedomDividend Will Help Red States Most! https://youtu.be/q4NVXFDaai4 #Yang2020 #YangGang",,,#Yang #republican #FreedomDividend #Yang2020 #YangGang,1200810694196772865,https://twitter.com/o_oMalcolm/status/1200810694196772865
2019-11-30 16:13:38,RobynLangdon,,0,0,0,"Do Boomers think the Freedom Dividend a HandOut? Maybe not https://youtu.be/fEosW8PhUsc #yang",,,#yang,1200810123230433281,https://twitter.com/RobynLangdon/status/1200810123230433281
2019-11-30 15:42:00,Crazyqueso1,,1,0,1,"#yanggang if emails are turning you off from the campaign, Receive Fewer Emails! They have to send all the fundraising emails and this is the same as other energetic antiestablishment campaigns without Super PAC and huge name recognition. Go #Yang go!! ",,,#yanggang #Yang,1200802165700354059,https://twitter.com/Crazyqueso1/status/1200802165700354059
2019-11-30 15:16:50,RillyKewl,AndrewYang,0,0,0,"#Yang on #UsefulIdiotsPod ",,,#Yang #UsefulIdiotsPod,1200795832099979265,https://twitter.com/RillyKewl/status/1200795832099979265
2019-11-30 15:08:37,LibtardSavant,UPP_Polls,0,0,3,"#Yang #Yang2020 #MATH #yangbeatstrump #YangGang #HumanityFirst Yang is my first choice",,,#Yang #Yang2020 #MATH #yangbeatstrump #YangGang #HumanityFirst,1200793761871257600,https://twitter.com/LibtardSavant/status/1200793761871257600
2019-11-30 14:42:00,UBIduelists,,0,0,0,"Yooooo....Imagine how many booster packs you could buy with an extra 1000$per month #YangGang #AndrewYang #Yang #Yugioh #Konami #TCG #Duel #Duelists",,,#YangGang #AndrewYang #Yang #Yugioh #Konami #TCG #Duel #Duelists,1200787066319228930,https://twitter.com/UBIduelists/status/1200787066319228930
2019-11-30 14:39:32,SaraEnki,,0,0,0,"Although there's a few misinterpretations of #yang's message it's still a pretty cool piece - Despite bashing big tech, Andrew Yang gains support in Silicon Valley https://youtu.be/kGt2NAkTvNE #yanggang #TIMEForYang #democrats #wired #cbsnews #letyangspeak #boycottmsnbc",,,#yang #yanggang #TIMEForYang #democrats #wired #cbsnews #letyangspeak #boycottmsnbc,1200786446342402049,https://twitter.com/SaraEnki/status/1200786446342402049
2019-11-30 14:17:11,IamJohnBurnett,,3,5,1,"#AndrewYang accused of firing woman from tutoring company after she complained about pay disparity https://fxn.ws/2DqxNMV #FoxNews #Yang #Yang2020 #AndrewYang2020",,,#AndrewYang #FoxNews #Yang #Yang2020 #AndrewYang2020,1200780818056122369,https://twitter.com/IamJohnBurnett/status/1200780818056122369
2019-11-30 14:01:34,B12Business,B12Business,0,0,0,"7. I appreciate @AndrewYang thoughtfulness on the tough issues. I believe he will listen to both sides of a issue and make the best decision. His approach is #win/win not win/lose. When #Yang becomes President everyone wins. America wins. He calls it #MATH",,@AndrewYang,#win #Yang #MATH,1200776889557815308,https://twitter.com/B12Business/status/1200776889557815308
2019-11-30 13:45:45,hjub,brucedotio,1,0,18,"Idk, maybe. I just dont feel like he understands the disruption in the economy fro automation and AI. UBI isnt what got #Yang my vote, it was showing that he understands these issues.",,,#Yang,1200772907745644545,https://twitter.com/hjub/status/1200772907745644545
2019-11-30 13:14:23,Tuyulll85552197,,0,0,2,"Dia cinta anda. Anda juga cinta dia. Kalau dia jodoh saya. Anda bisa apa? #selamatmalam #malamminggu #untuk #kamu #yang #masih #bersamanya",,,#selamatmalam #malamminggu #untuk #kamu #yang #masih #bersamanya,1200765016397488128,https://twitter.com/Tuyulll85552197/status/1200765016397488128
2019-11-30 13:12:27,KentuckyEntwife,,1,0,2,"Which of course brings up the concept of #UniversalBasicIncome which I know #Yang has floated, sort of. It's a concept I first read about as a teen in the writings of SF author Robert Heinlein. And while Yang is not my first choice, I do wonder if UBI might not be a good idea. 6/",,,#UniversalBasicIncome #Yang,1200764527240810496,https://twitter.com/KentuckyEntwife/status/1200764527240810496
2019-11-30 13:08:54,RennardThomas,,0,1,0,"#Yang Gang. It’s money day .... let’s get this done !",,,#Yang,1200763636920324096,https://twitter.com/RennardThomas/status/1200763636920324096
2019-11-30 12:29:09,tthompie,jofortrump,0,1,1,"Or the #DNC for rigging and the polsters for rigged polling or the #VeryFakeMedia But yes, Kamala doing a finger point outward and it lands on the LEFT #TulsiMediaBlackout and the continuous #yang ooopsie of making a qualified invisible",,,#DNC #VeryFakeMedia #TulsiMediaBlackout #yang,1200753634126024706,https://twitter.com/tthompie/status/1200753634126024706
2019-11-30 12:22:17,erika_wentworth,,0,0,0,"#YangGang #yang Highlight this? ",,,#YangGang #yang,1200751904097275909,https://twitter.com/erika_wentworth/status/1200751904097275909
2019-11-30 12:14:25,wharrio50,,0,0,0,"... If #BernieSanders can overcome owning 3 Mansions.. a red INDY styled Venezuelan Red roadster in a heated garage and jet travel of almost $750,000, he might beat #CoryBooker at start time.. but I'll pick #Yang",,,#BernieSanders #CoryBooker #Yang,1200749923278475265,https://twitter.com/wharrio50/status/1200749923278475265
2019-11-30 11:24:19,JamGolf3,davecatanese,0,0,2,"None of the above. #yang",,,#yang,1200737317666906112,https://twitter.com/JamGolf3/status/1200737317666906112
2019-11-30 11:00:04,TribunNew5,,0,0,0,"Pengantin Baru #Bisa Dapat Kartu Pra Kerja Berisi Rp , 7,6 Juta #yang Dibagi Maret 2020, Begini Caranya https://tribunnews.biz/",,,#Bisa #yang,1200731211649433601,https://twitter.com/TribunNew5/status/1200731211649433601
2019-11-30 10:36:49,piaYANGhyeseung,,0,6,30,"- 여러분들께서 올려주신 영상으로 만들어봤습니다 - PIA LAST CONCERT 'ONLY THE YOUTH BURNS' 2019.11.15-16 #노들섬라이브하우스 - #피아 #PIA #밴드피아 #BANDPIA #양혜승 #드러머양혜승 #YANG #HYESEUNG #DRUM #DRUMMER #DrumLife #PearlDrums #PaisteCymbals",,,#PIA #BANDPIA #YANG #HYESEUNG #DRUM #DRUMMER #DrumLife #PearlDrums #PaisteCymbals,1200725362059042816,https://twitter.com/piaYANGhyeseung/status/1200725362059042816
2019-11-30 10:08:52,Mominleftfield,,0,0,0,"Grocery-Packing Robots Are Aiming For World Domination https://www.bloomberg.com/opinion/articles/2019-11-29/ocado-japan-deal-is-tall-order-on-top-of-kroger-ramp-up #Kroger partnership #gigeconomy #jobs #usa #workers #economic #money #jobs #yang",,,#Kroger #gigeconomy #jobs #usa #workers #economic #money #jobs #yang,1200718329440350209,https://twitter.com/Mominleftfield/status/1200718329440350209
2019-11-30 10:06:25,aprie_net,,0,0,0,"#label #total #physical #profesional #mini #murah #ke #yang #dan #australia #program Tidak ada keraguan bahwa Nintendo mendapatkan jackpot dengan Switch, sehingga peluncuran iterasi yang sedikit lebih murah seharusnya tidak mengeju…https://lnkd.in/fC6kgmT",,,#label #total #physical #profesional #mini #murah #ke #yang #dan #australia #program,1200717711279570948,https://twitter.com/aprie_net/status/1200717711279570948
